Regulation,Year,Agency,Cost
"Amendment to and Partial Revocation of Prohibited Transaction Exemption (PTE)","2016","Labor","0.0"
"Multiemployer Pension Plan Information Made Available on Request","2010","Labor","15.7m"
"Best Interest Contract Exemption","2016","Labor","0.0"
"Class Exemption for Principal Transactions","2016","Labor","0.0"
"Definition of the Term “Fiduciary”; Conflict of Interest Rule","2016","Labor","31.5b"
"DEFINITION OF "EMPLOYER" UNDER SECTION 3(5) OF ERISA--ASSOCIATION HEALTH PLANS ","2018","Labor","0.0"
"Improve Tracking of Workplace Injuries and Illnesses","2016","Labor","28.4m"
"Limited Extension of Select Compliance Dates for Occupational Exposure to Beryllium in General Industry","2018","Labor","-12.1m"
"Genetic Information Nondiscrimination Act","2016","Labor","51.6m"
"Examinations of Working Places in Metal and Nonmetal Mines","2018","Labor","-276.0m"
"Amendment to Prohibited Transaction Class Exemption 84-14 for Transactions Determined by Independent Qualified Professional Asset Managers (the QPAM Exemption)","2024","Labor","11.0m"
"Regulations Under the Americans With Disabilities Act","2016","Labor","42.3m"
"Revising the Beryllium Standard for General Industry","2018","Labor","-2.6m"
"Overtime Rule","2016","Labor","2.9b"
"Rescission of Rule Interpreting “Advice” Exemption in Section 203(c) of the Labor-Management Reporting and Disclosure Act","2018","Labor","-652.4m"
"Cranes and Derricks in Construction","2010","Labor","2.3m"
"Discrimination on the Basis of Sex","2016","Labor","60.9m"
"Cranes and Derricks in Construction: Operator Qualification","2018","Labor","-16.8m"
"CIVIL PENALTIES INFLATION ADJUSTMENT","2016","Labor","0.0"
"Silica; Approval of Collections of Information","2016","Labor","0.0"
"Joint Rule for Unified and Combined State Plans","2016","Labor","626.8m"
"Workforce Innovation and Opportunity Act","2016","Labor","350.4m"
"Establishing Paid Sick Leave for Federal Contractors","2016","Labor","241.9m"
"Administrative Wage Garnishment Procedures","2016","Labor","0.0"
"Personal Protective Equipment (Fall Protection Systems)","2016","Labor","305.0m"
"Implementation of the Nondiscrimination and Equal Opportunity","2016","Labor","120.0m"
"Claims Procedure for Plans Providing Disability Benefits","2016","Labor","134.8m"
"Apprenticeship Programs; Equal Employment Opportunity","2016","Labor","458.9m"
"Regulations Implementing the Longshore and Harbor Workers' Compensation Act","2005","Labor","0.0"
"Revising the Notification Requirements","2010","Labor","1.5m"
"Lowering Miners' Exposure to Respirable Crystalline Silica and Improving Respiratory Protection","2024","Labor","1.3b"
"Procedures for the Handling of Retaliation Complaints","2010","Labor","0.0"
"Procedures for the Handling of Retaliation Complaints","2010","Labor","0.0"
"Criteria and Procedures for Proposed Assessment of Civil Penalties","2007","Labor","31.6m"
"Labor Certification for the Permanent Employment of Aliens in the United States","2007","Labor","178.6m"
"Electrical Standard","2007","Labor","9.6m"
"Improve Tracking of Workplace Injuries and Illnesses","2023","Labor","71.0m"
"Employer Payment for Personal Protective Equipment","2007","Labor","85.7m"
"Personal Protective Equipment in Construction","2024","Labor","9.4m"
"Annual Reporting and Disclosure","2007","Labor","-97.4m"
"NASA Federal Acquisition Regulation Supplement: Revised Voucher and Invoice Submission","2018","NASA","-144.0k"
"Federal Credit Union Bylaws","2023","National Credit Union Administration","0.0"
"Loan Participations; Purchase, Sale and Pledge of Eligible Obligations","2013","National Credit Union Administration","0.0"
"Liquidity and Contingency Funding Plans","2013","National Credit Union Administration","0.0"
"Credit Union Service Organizations","2013","National Credit Union Administration","0.0"
"Financial Innovation: Loan Participations, Eligible Obligations, and Notes of Liquidating Credit Unions","2023","National Credit Union Administration","0.0"
"Loan Workouts and Nonaccrual Policy, and Regulatory Reporting","2012","National Credit Union Administration","0.0"
"Truth in Savings","2006","National Credit Union Administration","0.0"
"Interest Rate Risk Policy and Program","2012","National Credit Union Administration","0.0"
"Temporary Regulatory Relief in Response to COVID-19","2020","National Credit Union Administration","0.0"
"Central Liquidity Facility","2020","National Credit Union Administration","0.0"
"Temporary Regulatory Relief in Response to COVID-19-Prompt Corrective Action","2020","National Credit Union Administration","0.0"
"Truth in Savings","2005","National Credit Union Administration","0.0"
"Share Insurance and Appendix","2011","National Credit Union Administration","0.0"
"Federal Credit Union Ownership of Fixed Assets","2015","National Credit Union Administration","0.0"
"Risk-Based Capital","2015","National Credit Union Administration","5.1m"
"Alternatives to the Use of Credit Ratings","2012","National Credit Union Administration","0.0"
"Security Program and Appendix B-Guidance on Response Programs","2005","National Credit Union Administration","0.0"
"Derivatives","2014","National Credit Union Administration","4.6m"
"Capital Planning and Stress Testing","2014","National Credit Union Administration","0.0"
"Safe Harbor","2017","National Credit Union Administration","0.0"
"Corporate Credit Unions","2010","National Credit Union Administration","0.0"
"Capital Planning and Supervisory Stress Testing","2018","National Credit Union Administration","0.0"
"Chartering and Field of Membership","2018","National Credit Union Administration","0.0"
"Member Business Loans; Commercial Lending","2016","National Credit Union Administration","0.0"
"Chartering and Field of Membership Manual","2016","National Credit Union Administration","0.0"
"Federal Credit Union Occupancy, Planning","2016","National Credit Union Administration","0.0"
"JOINT EMPLOYER STATUS UNDER THE NATIONAL LABOR RELATIONS ACT","2020","National Labor Relations Board","0.0"
"REPRESENTATION--CASE PROCEDURES: ELECTION BARS; PROOF OF MAJORITY SUPPORT IN CONSTRUCTION-INDUSTRY COLLECTIVE-BARGAINING RELATIONSHIPS","2020","National Labor Relations Board","0.0"
"Notification of Employee Rights, National Labor Relations Act [OVERTURNED]","2011","National Labor Relations Board","386.4m"
"Representation-Case Procedures","2014","National Labor Relations Board","2.0k"
"Occupational Dose Records, Labeling Containers, and the Total Effective Dose","2007","Nuclear Regulatory Commission","-236.0m"
"FEE RECOVERY FOR FY 2007","2007","Nuclear Regulatory Commission","0.0"
"SEISMIC EVALUATION GUIDANCE","2013","Nuclear Regulatory Commission","0.0"
"PHYSICAL PROTECTION OF BYPRODUCT MATERIAL ","2013","Nuclear Regulatory Commission","0.0"
"FEE RECOVERY","2013","Nuclear Regulatory Commission","0.0"
"PRICE-ANDERSON ACT FINANCIAL PROTECTION REGULATIONS ","2013","Nuclear Regulatory Commission","0.0"
"FEE RECOVERY FOR FY 2008","2008","Nuclear Regulatory Commission","0.0"
"REVISION OF FEE SCHEDULES; FEE RECOVERY","2012","Nuclear Regulatory Commission","0.0"
"National Source Tracking of Sealed Sources","2006","Nuclear Regulatory Commission","3.9m"
"REVISION OF FEE SCHEDULES","2006","Nuclear Regulatory Commission","0.0"
"Emergency Preparedness for Small Modular Reactors and Other New Technologies","2023","Nuclear Regulatory Commission","-5.6m"
"Power Reactor Security Requirements","2009","Nuclear Regulatory Commission","154.4m"
"REVISION OF FEE SCHEDULES","2009","Nuclear Regulatory Commission","0.0"
"Revision of Fee Schedules; Fee Recovery for FY 2010","2010","Nuclear Regulatory Commission","0.0"
"Approval of American Society of Mechanical Engineers' Code Cases","2020","Nuclear Regulatory Commission","-4.5m"
"American Society of Mechanical Engineers 2015-2017 Code Editions Incorporation by Reference","2020","Nuclear Regulatory Commission","-3.1m"
"Decommissioning Planning","2011","Nuclear Regulatory Commission","40.0m"
"Revisions to Transportation Safety Requirements","2015","Nuclear Regulatory Commission","0.0"
"Enhancements to Emergency Preparedness Regulations","2011","Nuclear Regulatory Commission","0.0"
"REVISION OF FEE SCHEDULES","2015","Nuclear Regulatory Commission","0.0"
"FEE RECOVERY FOR FISCAL YEAR 2011","2011","Nuclear Regulatory Commission","0.0"
"American Society of Mechanical Engineers Code Cases and Update Frequency","2024","Nuclear Regulatory Commission","-136.7m"
"Renewing Nuclear Power Plant Operating Licenses-Environmental Review","2024","Nuclear Regulatory Commission","-61.0m"
"American Society of Mechanical Engineers 2019-2020 Code Editions","2022","Nuclear Regulatory Commission","-10.2m"
"Alternate Fracture Toughness Requirements for Protection Against Pressurized Thermal Shock Events","2010","Nuclear Regulatory Commission","0.0"
"American Society of Mechanical Engineers 2021-2022 Code Editions","2024","Nuclear Regulatory Commission","-650.0k"
"Fitness for Duty Drug Testing Requirements","2022","Nuclear Regulatory Commission","-418.0k"
"REVISION OF FEE SCHEDULES; FEE RECOVERY FOR FISCAL YEAR 2019","2019","Nuclear Regulatory Commission","0.0"
"Mitigation of Beyond-Design-Basis Events","2019","Nuclear Regulatory Commission","7.2m"
"Enhanced Weapons, Firearms Background Checks, and Security Event Notifications","2023","Nuclear Regulatory Commission","2.7m"
"FEE RECOVERY FOR FISCAL YEAR 2014 ","2014","Nuclear Regulatory Commission","0.0"
"REVISION OF FEE SCHEDULES; FEE ","2005","Nuclear Regulatory Commission","0.0"
"REVISION OF FEE SCHEDULES; FEE RECOVERY FOR FISCAL YEAR 2017","2017","Nuclear Regulatory Commission","0.0"
"Incorporation by Reference of American Society of Mechanical Engineers Codes","2017","Nuclear Regulatory Commission","47.7m"
"Requirements for Maintenance of Inspections","2012","Nuclear Regulatory Commission","1.0m"
"REVISION OF FEE SCHEDULES; FEE RECOVERY FOR FISCAL YEAR 2018","2018","Nuclear Regulatory Commission","0.0"
"INFLATION ADJUSTMENTS TO THE PRICE-ANDERSON ACT FINANCIAL PROTECTION REGULATIONS ","2018","Nuclear Regulatory Commission","0.0"
"Approval of American Society of Mechanical Engineers' Code Cases","2018","Nuclear Regulatory Commission","-4.5m"
"Approval of American Society of Mechanical Engineers' Code Cases","2022","Nuclear Regulatory Commission","-3.9m"
"Medical Use of Byproduct Material-Medical Event Definitions, Training and Experience, and Clarifying Amendments","2018","Nuclear Regulatory Commission","16.4m"
"REVISION OF FEE SCHEDULES","2016","Nuclear Regulatory Commission","0.0"
"Fitness for Duty Programs","2008","Nuclear Regulatory Commission","481.0m"
"PPACA; Establishment of the Multi-State Exchanges","2013","Office of Personnel Management","0.0"
"Paid Parental Leave","2020","Office of Personnel Management","84.3m"
"PPACA: Establishment of the Multi-State Plan Program for Exchanges","2015","Office of Personnel Management","0.0"
"FEDERAL EMPLOYEES DENTAL AND VISION INSURANCE PROGRAM: EXTENSION OF ELIGIBILITY TO CERTAIN TRICARE-ELIGIBLE INDIVIDUALS; EFFECTIVE DATE OF ENROLLMENT ","2018","Office of Personnel Management","0.0"
"Setting and Adjusting Patent Fees","2013","Patent and Trademark Office","931.0m"
"Examination Guidelines for Implementing the First Inventor To File Provisions","2013","Patent and Trademark Office","0.0"
"Standard for Presentation of Nucleotide and Amino Acid Sequence Listings Using eXtensible Markup Language (XML) in Patent Applications To Implement WIPO Standard ST.26; Incorporation by Reference","2022","Patent and Trademark Office","0.0"
"Agreement Concerning International Registration of Industrial Designs","2015","Patent and Trademark Office","5.0m"
"Requirement of U.S. Licensed Attorney for Foreign Trademark Applicants and Registrants","2019","Patent and Trademark Office","0.0"
"Rules of Practice for Trials Before the Patent Trial and Appeal Board","2012","Patent and Trademark Office","94.2m"
"Transitional Program for Covered Business Method Patents","2012","Patent and Trademark Office","23.9m"
"SETTING AND ADJUSTING PATENT FEES DURING FISCAL YEAR 2017","2017","Patent and Trademark Office","0.0"
"Special Financial Assistance by PBGC","2021","Pension Benefit Guaranty Corporation","14.7m"
"Methods for Computing Withdrawal Liability, Multiemployer Pension Reform Act of 2014","2021","Pension Benefit Guaranty Corporation","-1.5m"
"Special Financial Assistance by PBGC","2022","Pension Benefit Guaranty Corporation","15.3m"
"Special Financial Assistance by PBGC-Withdrawal Liability Condition Exception","2023","Pension Benefit Guaranty Corporation","6.4m"
"Terminated and Insolvent Multiemployer Plans and Duties of Plan Sponsors","2019","Pension Benefit Guaranty Corporation","-540.0k"
"LARGE-PLAN FLAT-RATE PREMIUM ","2014","Pension Benefit Guaranty Corporation","0.0"
"Premium Rates; Payment of Premiums; Reducing Regulatory Burden","2014","Pension Benefit Guaranty Corporation","-6.0m"
"Missing Participants","2017","Pension Benefit Guaranty Corporation","-26.0k"
"Multiemployer Plans; Valuation and Notice Requirements","2014","Pension Benefit Guaranty Corporation","-460.0k"
"Mergers and Transfers Between Multiemployer Plans","2018","Pension Benefit Guaranty Corporation","223.0k"
"Annual Financial and Actuarial Information Reporting","2016","Pension Benefit Guaranty Corporation","6.6m"
"Standards for Covered Clearing Agencies","2016","Securities and Exchange Commission","233.5m"
"Conflict Minerals [OVERTURNED]","2012","Securities and Exchange Commission","4.7b"
"Investment Company Liquidity Risk Management Programs","2016","Securities and Exchange Commission","855.0m"
"Disclosure of Payments by Resource Extraction Issuers [OVERTURNED]","2012","Securities and Exchange Commission","0.0"
"Investment Company Reporting Modernization","2016","Securities and Exchange Commission","172.1m"
"Investment Company Swing Pricing","2016","Securities and Exchange Commission","286.0m"
"EXEMPTIONS TO FACILITATE INTRASTATE AND REGIONAL SECURITIES OFFERINGS","2016","Securities and Exchange Commission","0.0"
"Good Faith Determinations of Fair Value","2021","Securities and Exchange Commission","1.7b"
"Management's Discussion and Analysis, Selected Financial Data, and Supplementary Financial Information","2021","Securities and Exchange Commission","-39.4m"
"Revisions to Rules 144 and 145","2007","Securities and Exchange Commission","0.0"
"Revisions to the Eligibility Requirements for Primary Securities Offerings on Forms","2007","Securities and Exchange Commission","-12.4m"
"Facilitating Capital Formation and Expanding Investment Opportunities by Improving Access to Capital in Private Markets","2021","Securities and Exchange Commission","1.7m"
"Extension of Interactive Data Voluntary Reporting Program on the Edgar System","2007","Securities and Exchange Commission","560.0k"
"Disclosure of Payments by Resource Extraction Issuers","2021","Securities and Exchange Commission","108.0m"
"Internet Availability of Proxy Materials","2007","Securities and Exchange Commission","-161.4m"
"Revisions to Form S-11 to Permit Historical Incorporation by Reference","2008","Securities and Exchange Commission","-45.5m"
"Oversight of Credit Rating Agencies Registered as Nationally Recognized Statistical","2007","Securities and Exchange Commission","8.9m"
"Shareholder Choice Regarding Proxy Materials","2007","Securities and Exchange Commission","154.7m"
"Adoption of Updated EDGAR Filer Manual, Proposed Collection and Comment Request for Form ID","2021","Securities and Exchange Commission","0.0"
"Temporary Rule Regarding Principal Trades With Certain Advisory Clients","2007","Securities and Exchange Commission","37.2m"
"INTERNAL CONTROL OVER FINANCIAL REPORTING","2007","Securities and Exchange Commission","0.0"
"Money Market Fund Reforms; Form PF Reporting Requirements for Large Liquidity Fund Advisers; Technical Amendments to Form N-CSR and Form N-1A","2023","Securities and Exchange Commission","7.6m"
"Money Market Fund Reform","2010","Securities and Exchange Commission","148.3m"
"Investment Adviser Marketing","2021","Securities and Exchange Commission","502.4m"
"TERMINATION OF A FOREIGN PRIVATE ISSUER'S REGISTRATION","2007","Securities and Exchange Commission","0.0"
"Holding Foreign Companies Accountable Act Disclosure","2021","Securities and Exchange Commission","147.0k"
"Cybersecurity Risk Management, Strategy, Governance, and Incident Disclosure","2023","Securities and Exchange Commission","48.0m"
"Universal Proxy","2021","Securities and Exchange Commission","2.7m"
"Holding Foreign Companies Accountable Act Disclosure","2021","Securities and Exchange Commission","147.0k"
"Disclosure of Divestment","2008","Securities and Exchange Commission","145.0k"
"Filing Fee Disclosure and Payment Methods Modernization","2021","Securities and Exchange Commission","7.2m"
"Extension of Temporary Registration of Municipal Advisors","2012","Securities and Exchange Commission","210.0k"
"Removal of Certain References to Credit Ratings","2013","Securities and Exchange Commission","12.1m"
"Lost Securityholders and Unresponsive Payees","2013","Securities and Exchange Commission","0.0"
"Exemption for Certain Exchange Members","2023","Securities and Exchange Commission","2.5m"
"Private Fund Advisers; Documentation of Registered Investment Adviser Compliance Reviews","2023","Securities and Exchange Commission","16.7b"
"Disqualification of Felons and Other “Bad Actors” From Rule 506 Offerings","2013","Securities and Exchange Commission","264.0k"
"Eliminating the Prohibition Against General Solicitation and General Advertising","2013","Securities and Exchange Commission","26.2m"
"DEFINITION OF ELIGIBLE PORTFOLIO","2008","Securities and Exchange Commission","0.0"
"Broker-Dealer Reports","2013","Securities and Exchange Commission","72.0m"
"Financial Responsibility Rules for Broker-Dealers","2013","Securities and Exchange Commission","50.8m"
"BROKER-DEALER REPORTS ","2013","Securities and Exchange Commission","0.0"
"Registration of Municipal Advisors","2013","Securities and Exchange Commission","30.9m"
"Updating EDGAR Filing Requirements and Form 144 Filings","2022","Securities and Exchange Commission","29.8m"
"Amendments to Municipal Securities Disclosure","2008","Securities and Exchange Commission","18.9m"
"Electronic Submission of Applications for Orders Under the Advisers Act and the Investment Company Act, Confidential Treatment Requests for Filings on Form 13F, and Form ADV-NR; Amendments to Form 13F","2022","Securities and Exchange Commission","25.1m"
"Investment Company Names","2023","Securities and Exchange Commission","1.4b"
"Asset Backed Securities","2005","Securities and Exchange Commission","41.2m"
"Reporting of Securities Loans","2023","Securities and Exchange Commission","989.1m"
"Proxy Voting Advice","2022","Securities and Exchange Commission","-95.6m"
"Modernization of Beneficial Ownership Reporting","2023","Securities and Exchange Commission","161.0m"
"Internal Control Over Financial Reporting in Exchange Act Periodic Reports","2006","Securities and Exchange Commission","350.0k"
"Executive Compensation and Related Person Disclosure","2006","Securities and Exchange Commission","11.0m"
"Electronic Filing of Transfer Agent Forms","2006","Securities and Exchange Commission","0.0"
"Fund of Funds Investments","2006","Securities and Exchange Commission","0.0"
"Mutual Fund Redemption Fees","2006","Securities and Exchange Commission","-667.9m"
"Regulation S-P: Privacy of Consumer Financial Information and Safeguarding Customer Information","2024","Securities and Exchange Commission","1.8b"
"Modernization of Oil and Gas Reporting","2009","Securities and Exchange Commission","4.7m"
"Indexed Annuities And Certain Other Insurance Contracts","2009","Securities and Exchange Commission","72.0m"
"XBRL Voluntary Financial Reporting Program on the EDGAR System","2005","Securities and Exchange Commission","1.7m"
"Enhanced Disclosure and New Prospectus Delivery Option","2009","Securities and Exchange Commission","-41.2m"
"Amendments to Rules for Statistical Rating Organizations","2009","Securities and Exchange Commission","73.1m"
"Interactive Data To Improve Financial Reporting","2009","Securities and Exchange Commission","615.8m"
"Interactive Data for Mutual Fund Risk","2009","Securities and Exchange Commission","-505.0k"
"Limitations on Affiliate Marketing","2009","Securities and Exchange Commission","10.6m"
"Disclosure of Certain Money Market Fund Portfolio Holdings","2009","Securities and Exchange Commission","590.1k"
"Listing Standards for Compensation Committees","2012","Securities and Exchange Commission","1.6m"
"References to Ratings of Nationally Recognized Statistical Rating Organizations","2009","Securities and Exchange Commission","2.8m"
"Amendments to Rules for Nationally Recognized Statistical Rating Organizations","2009","Securities and Exchange Commission","51.1m"
"Clearing Agency Governance and Conflicts of Interest","2023","Securities and Exchange Commission","0.0"
"FINANCIAL REPORTING IN EXCHANGE ACT PERIODIC REPORTS","2008","Securities and Exchange Commission","0.0"
"Risk Mitigation Techniques for Uncleared Security-Based Swaps","2020","Securities and Exchange Commission","313.3m"
"Proxy Disclosure Enhancements","2009","Securities and Exchange Commission","57.7m"
"Clearing Agency Standards","2012","Securities and Exchange Commission","13.8m"
"Cross-Border Application of Certain Security-Based Swap Requirements","2020","Securities and Exchange Commission","274.9m"
" INTERNAL CONTROL OVER FINANCIAL REPORTING","2009","Securities and Exchange Commission","0.0"
"Accelerated Filer and Large Accelerated Filer Definitions","2020","Securities and Exchange Commission","-151.1m"
"Prohibition Against Conflicts of Interest in Certain Securitizations","2023","Securities and Exchange Commission","19.0m"
"Financial Disclosures About Guarantors and Issuers of Guaranteed Securities and Affiliates Whose Securities Collateralize a Registrant's Securities","2020","Securities and Exchange Commission","-15.7m"
"Updated Disclosure Requirements and Summary Prospectus for Variable Annuity and Variable Life Insurance Contracts","2020","Securities and Exchange Commission","81.7m"
"Pay Versus Performance","2022","Securities and Exchange Commission","38.3m"
"Temporary Amendments to Regulation Crowdfunding","2020","Securities and Exchange Commission","0.0"
"Securities Offering Reform for Closed-End Investment Companies","2020","Securities and Exchange Commission","53.7m"
"Political Contributions by Certain Investment Advisers","2010","Securities and Exchange Commission","24.6m"
"Amendments to Financial Disclosures About Acquired and Disposed Businesses","2020","Securities and Exchange Commission","-64.4m"
"Temporary Amendments to Regulation Crowdfunding; Extension","2020","Securities and Exchange Commission","0.0"
"Exemptions From the Proxy Rules for Proxy Voting Advice","2020","Securities and Exchange Commission","101.1m"
"Amendments to Procedures With Respect to Applications Under the Investment Company Act of 1940","2020","Securities and Exchange Commission","525.0k"
"Modernization of Regulation S-K Items 101, 103, and 105","2020","Securities and Exchange Commission","-48.5m"
"Update of Statistical Disclosures for Bank and Savings and Loan Registrants","2020","Securities and Exchange Commission","1.6m"
"Publication or Submission of Quotations Without Specified Information","2020","Securities and Exchange Commission","0.0"
"Procedural Requirements and Resubmission Thresholds Under Exchange Act Rule 14a-8","2020","Securities and Exchange Commission","-10.5m"
"Whistleblower Program Rules","2020","Securities and Exchange Commission","0.0"
"Security-Based Swap Execution and Registration and Regulation of Security-Based Swap Execution Facilities","2023","Securities and Exchange Commission","17.5m"
"Fund of Funds Arrangements","2020","Securities and Exchange Commission","2.3b"
"Disclosure for Asset-Backed Securities Required by Section 943","2011","Securities and Exchange Commission","25.2m"
"Use of Derivatives by Registered Investment Companies and Business Development Companies","2020","Securities and Exchange Commission","737.5m"
"Exemptions for Advisers to Venture Capital Funds, Private Advisers","2011","Securities and Exchange Commission","350.0k"
"Amendments for Small and Additional Issues Exemptions Under the Securities Act","2015","Securities and Exchange Commission","32.1m"
"Extension of Temporary Registration of Municipal Advisors","2011","Securities and Exchange Commission","190.0k"
"Regulation SBSR-Reporting and Dissemination of Security-Based Swap Information","2015","Securities and Exchange Commission","470.0m"
"FAMILY OFFICES","2011","Securities and Exchange Commission","0.0"
"Security-Based Swap Data Repository Registration, Duties, and Core Principles","2015","Securities and Exchange Commission","372.7m"
"Implementing Amendments, Investment Advisers Act of 1940","2011","Securities and Exchange Commission","83.7m"
"Registration Process for Security-Based Swap Dealers","2015","Securities and Exchange Commission","14.2m"
"Process, Submissions for Review of Security-Based Swaps, Mandatory Clearing","2012","Securities and Exchange Commission","8.6m"
"Issuer Review of Assets in Offerings of Asset-Backed Securities","2011","Securities and Exchange Commission","8.4m"
"Pay Ratio Disclosure","2015","Securities and Exchange Commission","1.8b"
"Registration for Index-Linked Annuities and Registered Market Value Adjustment Annuities; Amendments To Form N-4 for Index-Linked Annuities, Registered Market Value Adjustment Annuities, and Variable Annuities; Other Technical Amendments","2024","Securities and Exchange Commission","5.6m"
